{
  "type": "https://eips.ethereum.org/EIPS/eip-8419#kya-policy-v1",
  "name": "Counterparty baseline for payments above 1,000 USDC",
  "kyaRegistry": "eip155:11155111:0x4444444444444444444444444444444444444444",
  "require": {
    "allOf": [
      {
        "schemeId": "0x0000000000000000000000000000000000000000000000000000000000000001",
        "minLevel": 2,
        "issuers": [
          "0x2222222222222222222222222222222222222222"
        ]
      },
      {
        "anyOf": [
          {
            "schemeId": "0x0000000000000000000000000000000000000000000000000000000000000002",
            "minLevel": 4,
            "issuers": [
              "0x3333333333333333333333333333333333333333"
            ],
            "allowEphemeral": true
          },
          {
            "schemeId": "0x0000000000000000000000000000000000000000000000000000000000000003",
            "minLevel": 3,
            "issuers": [
              "0x2222222222222222222222222222222222222222"
            ]
          }
        ]
      }
    ]
  },
  "onchain": {
    "evaluator": "eip155:11155111:0x5555555555555555555555555555555555555555",
    "rulesHash": "0x8703f7f542e0834b40914bb5a539fb89b9fec8254d02b19467af2f35c68741c9",
    "sufficient": false
  }
}
